,Organisation Name,Organisation Tagline,Technologies Used,GSOC Organisation Link
132,Plone Foundation,The premier python-based open source CMS,"python,  javascript,  html/css",https://summerofcode.withgoogle.com/archive/2017/organizations/4530756705583104/
133,PMD,An extensible cross-language static code analyzer.,"java,  javacc,  xml,  antlr,  xpath",https://summerofcode.withgoogle.com/archive/2017/organizations/5158578918785024/
134,Polly Labs,Promoting Polyhedral Compilation,"llvm,  integer set library,  ppcg,  pencil,  polly",https://summerofcode.withgoogle.com/archive/2017/organizations/4788561849090048/
135,Portland State University,Individual and Academic Open Source,"open hardware,  language-agnostic",https://summerofcode.withgoogle.com/archive/2017/organizations/5827042528460800/
136,PostgreSQL,"PostgreSQL is a powerful, open source object-relational database system.","postgresql,  c,  perl,  sql",https://summerofcode.withgoogle.com/archive/2017/organizations/5443503559540736/
137,Public Lab,Open hardware and software to help communities measure and analyze pollution,"javascript,  ruby,  ruby on rails",https://summerofcode.withgoogle.com/archive/2017/organizations/6029803371102208/
138,Python Software Foundation,Python is a programming language used by scientists & software developers alike.,python,https://summerofcode.withgoogle.com/archive/2017/organizations/5370985721102336/
139,QEMU,Open source machine emulator and virtualizer,"c,  python",https://summerofcode.withgoogle.com/archive/2017/organizations/4782716667035648/
140,Qubes OS,A reasonably secure operating system,"c,  python,  shell,  xen,  linux",https://summerofcode.withgoogle.com/archive/2017/organizations/5074771758809088/
141,R project for statistical computing,R is a free software environment for statistical computing and graphics,"r-project,  c,  c++,  fortran,  javascript",https://summerofcode.withgoogle.com/archive/2017/organizations/5555424770129920/
142,radare2,Radare2 reverse engineering framework and toolset,"c,  rust,  python,  nodejs",https://summerofcode.withgoogle.com/archive/2017/organizations/4795019735072768/
143,ReactOS,"ReactOS is a free, open source, Windows compatible operating system.","c,  c++",https://summerofcode.withgoogle.com/archive/2017/organizations/6057879303880704/
144,Red Hen Lab,Research on Multimodal Communication,"high performance computing,  machine learning,  opencv,  audio processing,  multimodal analysis",https://summerofcode.withgoogle.com/archive/2017/organizations/6645492838563840/
145,RoboComp,A simple robotics framework.,"c++,  cmake,  python,  openscenegraph,  qt",https://summerofcode.withgoogle.com/archive/2017/organizations/5477575937753088/
146,Rocket.Chat,The ultimate open source chat and messaging platform,"javascript,  meteor.js,  mongo,  webrtc",https://summerofcode.withgoogle.com/archive/2017/organizations/5788044225413120/
147,Rspamd,High-performance spam filtering system,"c,  lua,  cmake",https://summerofcode.withgoogle.com/archive/2017/organizations/5230067307249664/
148,RTEMS Project,RTEMS is a real-time operating system used around the world and in space.,"c,  python,  posix",https://summerofcode.withgoogle.com/archive/2017/organizations/6586933375401984/
149,Ruby on Rails,Ruby on Rails make web application development easy and fun.,"html,  ruby on rails,  ruby",https://summerofcode.withgoogle.com/archive/2017/organizations/5017499041005568/
150,Ruby Science Foundation,Tools for Scientific Computing in Ruby,"ruby,  science,  web,  data,  gpu",https://summerofcode.withgoogle.com/archive/2017/organizations/6710362682425344/
151,Sage Mathematical Software System,open source math software,"python,  cython,  c++,  c",https://summerofcode.withgoogle.com/archive/2017/organizations/5071296056524800/
152,Samba,Opening windows to a wider world.,"c,  python",https://summerofcode.withgoogle.com/archive/2017/organizations/5093706659004416/
153,Scala,The programming language where object-oriented meets functional.,"scala,  jvm",https://summerofcode.withgoogle.com/archive/2017/organizations/6452441306365952/
154,Scilab,Numerical computational package and high-level programming language.,"c++,  java,  python,  c,  opengl",https://summerofcode.withgoogle.com/archive/2017/organizations/6603475844595712/
155,ScummVM,ScummVM is a GSoC umbrella for game preservation projects,"c++,  sdl,  opengl,  assembly",https://summerofcode.withgoogle.com/archive/2017/organizations/6165044375060480/
156,Shogun Machine Learning Toolbox,Unified and efficient Machine Learning,"c/c++,  python,  swig,  machine learning,  cmake",https://summerofcode.withgoogle.com/archive/2017/organizations/4704476053110784/
157,Sigmah,Java/GWT platform for humanitarian project management,"gwt,  java,  postgresql",https://summerofcode.withgoogle.com/archive/2017/organizations/5019976297611264/
158,Software Product Data Exchange (SPDX),Promoting open source compliance through standard communication of SW licenses.,"rdf,  python,  java,  github,  c",https://summerofcode.withgoogle.com/archive/2017/organizations/6300304437936128/
159,STE||AR Group,The C++ Standards Library for Concurrency and Parallelism,"c++,  boost,  hpx,  c++17 parallel stl,  parallel algorithms",https://summerofcode.withgoogle.com/archive/2017/organizations/6145876204453888/
160,"Stony Brook University, Biomedical Informatics",Advance biomedical knowledge through innovative data science research,"big data,  apache spark,  matlab,  c++,  hadoop",https://summerofcode.withgoogle.com/archive/2017/organizations/6367868836904960/
161,strace,linux syscall tracer,"linux,  c,  git,  shell script,  make",https://summerofcode.withgoogle.com/archive/2017/organizations/6249254993526784/
162,Sugar Labs,"We make tools that learners use to explore, discover, create, and reflect.","python,  javascript,  gtk,  android",https://summerofcode.withgoogle.com/archive/2017/organizations/4675168001589248/
163,Sustainable Computing Research Group ( SCoRe ),"SCoRe has conducted research covering various aspects of Security, Mobile & IOT.","python,  java,  gcp,  android,  golan",https://summerofcode.withgoogle.com/archive/2017/organizations/4984473024200704/
164,SymPy,SymPy is a Python library for symbolic mathematics.,"python,  c++",https://summerofcode.withgoogle.com/archive/2017/organizations/5228947662962688/
165,"Systers, an Anita Borg Institute community",Helping women find their potential in code.,"android,  ios,  python,  java,  javascript",https://summerofcode.withgoogle.com/archive/2017/organizations/5429781541683200/
166,TEAMMATES @ National University of Singapore,An online feedback management system for students and teachers,"java,  javascript,  google app engine,  css,  java ee",https://summerofcode.withgoogle.com/archive/2017/organizations/5786366906466304/
167,The Center for Connected Learning and Computer-Based Modeling,NetLogo: A language and IDE for programming and scientific simulations,"javascript,  scala,  html5",https://summerofcode.withgoogle.com/archive/2017/organizations/4578118920568832/
168,The CGAL Project,C++ library of computational geometry and geometry processing,"c++,  git,  github",https://summerofcode.withgoogle.com/archive/2017/organizations/6565611412914176/
169,The Eclipse Foundation,"An amazing open source community of tools, projects, and  collaboration.","java,  geo,  iot,  che,  ide",https://summerofcode.withgoogle.com/archive/2017/organizations/5043263878725632/
170,The FreeType Project,FreeType font rendering library,"fonts,  opentype,  c,  library",https://summerofcode.withgoogle.com/archive/2017/organizations/4699374705704960/
171,The GNU Project,GNU is an operating system that is free software,"c,  guile,  python",https://summerofcode.withgoogle.com/archive/2017/organizations/5556772852989952/
172,The Honeynet Project,The Honeynet Project - R&D for Honeypot/Honeynet Technology and InfoSec Research,"python,  javascript,  golang,  android,  network stack",https://summerofcode.withgoogle.com/archive/2017/organizations/5512685819002880/
173,The Java Pathfinder Team,JPF is a highly extensible Java virtual machine built for software analysis,"java,  jvm,  android,  distributed systems",https://summerofcode.withgoogle.com/archive/2017/organizations/4740037845450752/
174,The Julia Language,A fresh approach to Technical Computing,"julia,  javascript,  gpu,  c/c++,  llvm",https://summerofcode.withgoogle.com/archive/2017/organizations/6682672759832576/
175,The Libreswan Project,Encrypting the internet using IKE and IPsec,"c,  python,  shell script",https://summerofcode.withgoogle.com/archive/2017/organizations/6311703818010624/
176,The Linux Foundation,A non-profit consortium dedicated to fostering the growth of Linux,"c,  c++,  cups,  mysql,  gtk",https://summerofcode.withgoogle.com/archive/2017/organizations/5902526847123456/
177,The MacPorts Project,Open Source package manager for Mac OS.,"tcl,  make,  git",https://summerofcode.withgoogle.com/archive/2017/organizations/5223416953044992/
178,The NetBSD Foundation,Of course it runs NetBSD!,"virtualization,  filesystems,  network stack,  arm,  mips",https://summerofcode.withgoogle.com/archive/2017/organizations/5856162406727680/
179,The ns-3 Network Simulator Project,ns-3 is a packet-level network simulator for research and education.,"c++,  python",https://summerofcode.withgoogle.com/archive/2017/organizations/5226418732531712/
180,The Processing Foundation,Our goal is to empower people of all backgrounds to learn how to program.,"java,  javascript,  python,  android,  opengl",https://summerofcode.withgoogle.com/archive/2017/organizations/5256745899261952/
181,The Wine Project,"Wine runs Windows applications on Linux, BSD, Solaris and Mac OS X.","c,  opengl,  directx,  x11,  win32",https://summerofcode.withgoogle.com/archive/2017/organizations/5417956825628672/
182,Tiled,"A free, easy to use and flexible 2D level editor.","qt,  c++,  git,  github",https://summerofcode.withgoogle.com/archive/2017/organizations/6470814639587328/
183,TimVideos,"Software & hardware to recording + streaming conferences, meetings & usergroups.","python,  verilog,  fpga,  vhdl,  c",https://summerofcode.withgoogle.com/archive/2017/organizations/6543856732471296/
184,Tor,Internet privacy and anonymity,"c,  python,  javascript,  c++",https://summerofcode.withgoogle.com/archive/2017/organizations/5273949793419264/
185,UCSC Xena,Helping biologists see the bigger picture in diverse cancer genomics data,"javascript,  react,  clojure,  d3,  python",https://summerofcode.withgoogle.com/archive/2017/organizations/4944943755821056/
186,"Urban Energy Systems Laboratory, Empa",HUES is a platform for modeling & analysis of distributed energy systems,"python,  gis,  fast fluid dynamics",https://summerofcode.withgoogle.com/archive/2017/organizations/4513544758362112/
187,VideoLAN,"A team of volunteers, believing in the power of open source multimedia.","c++,  c,  opengl,  qt,  assembly",https://summerofcode.withgoogle.com/archive/2017/organizations/4898083515138048/
188,ViSP,Visual tracking and visual servoing library,"vision,  c++",https://summerofcode.withgoogle.com/archive/2017/organizations/4892929554382848/
189,Wikimedia Foundation,Global movement whose mission is to bring free educational content to the world,"php,  javascript,  html,  css,  jquery",https://summerofcode.withgoogle.com/archive/2017/organizations/6468952502829056/
190,WorldBrain - Verifying the Internet with Science,"Full-text search your history, bookmarks and all your apps.","reactjs,  javascript",https://summerofcode.withgoogle.com/archive/2017/organizations/6393325913374720/
191,WSO2,Comprehensive and open source middleware platform that spans the breadth of SOA,"soa,  middleware,  java,  distributed computing,  web services",https://summerofcode.withgoogle.com/archive/2017/organizations/6070843662663680/
192,wxWidgets,Library for creating portable native GUIs in C++,"c++,  gtk+,  win32,  cocoa",https://summerofcode.withgoogle.com/archive/2017/organizations/5262324659126272/
193,X.Org Foundation,"X Window System and related projects (Mesa, DRI, Wayland, etc.)","opengl,  vulkan,  x11,  wayland,  opencl",https://summerofcode.withgoogle.com/archive/2017/organizations/6339354280591360/
194,Xapian Search Engine Library,"Fast, scalable and flexible search","c++,  unicode,  swig,  linux,  golang",https://summerofcode.withgoogle.com/archive/2017/organizations/6189339662876672/
195,XBMC Foundation,Kodi Media Center,"python,  c++11,  xml,  git,  drupal",https://summerofcode.withgoogle.com/archive/2017/organizations/5704018827411456/
196,Xen Project,Bringing the power of virtualization everywhere,"linux,  free/netbsd,  asm/c/c++,  qemu,  ocaml",https://summerofcode.withgoogle.com/archive/2017/organizations/5748328394391552/
197,XMPP Standards Foundation,Secure messaging with open standards,"xmpp,  c++,  java,  erlang,  javascript",https://summerofcode.withgoogle.com/archive/2017/organizations/6062681614188544/
198,XWiki,The Advanced Open Source Enterprise Wiki,"java,  javascript,  html5,  css3,  velocity",https://summerofcode.withgoogle.com/archive/2017/organizations/6636322546515968/
199,Zenodo,A free and open digital archive for the long-tail of science.,"python,  postgresql,  flask,  angularjs,  elasticsearch",https://summerofcode.withgoogle.com/archive/2017/organizations/4744852235354112/
200,Zulip,"Powerful, modern, open source group chat, complete with apps for every platform.","python,  django,  javascript,  react native,  electron",https://summerofcode.withgoogle.com/archive/2017/organizations/4533090483437568/
