,Organisation Name,Organisation Tagline,Technologies Used,GSOC Organisation Link
0,52°North Initiative for Geospatial Open Source Software GmbH,52°North works on innovative ideas and technologies in geoinformatics.,"web services,  ogc standards,  java,  javascript,  web",https://summerofcode.withgoogle.com/archive/2017/organizations/4959751460880384/
1,AboutCode,"Open Source for Open Source: software license, origin and packages discovery","python,  c/c++,  javascript,  shell script,  static analysis",https://summerofcode.withgoogle.com/archive/2017/organizations/6448304984424448/
2,AerospaceResearch.net,Making Space Together,"python,  c/c++,  vhdl,  boinc",https://summerofcode.withgoogle.com/archive/2017/organizations/6713622831038464/
3,aimacode,"Code for the book ""Artificial Intelligence: A Modern Approach""","python,  javascript,  machine learning,  artificial intelligence,  java",https://summerofcode.withgoogle.com/archive/2017/organizations/6119722806411264/
4,Amahi,Making Home Networking and Storage Simple,"android,  golang,  restful api,  streaming,  ruby on rails",https://summerofcode.withgoogle.com/archive/2017/organizations/6673844588773376/
5,AOSSIE - Australian Open Source Software Innovation and Education,Umbrella Org for Open-Source Projects in Australia,"scala,  javascript/html/css,  automated reasoning,  android/ios,  xcode",https://summerofcode.withgoogle.com/archive/2017/organizations/4780102642565120/
6,Apache Software Foundation,Providing open source software to the public free of charge,"java,  c,  erlang",https://summerofcode.withgoogle.com/archive/2017/organizations/4633151007621120/
7,Apertium,Free/open-source rule-based machine translation,"c++,  xml,  python,  nlp",https://summerofcode.withgoogle.com/archive/2017/organizations/6618812501721088/
8,Apertus Association,Open Technology for Professional Film Production,"fpga,  vhdl,  c,  linux,  c++",https://summerofcode.withgoogle.com/archive/2017/organizations/6354847569805312/
9,appleseedhq,A modern open source rendering engine for animation and visual effects,"c++,  python,  qt",https://summerofcode.withgoogle.com/archive/2017/organizations/6110372931043328/
10,ArduPilot,The worlds most advanced open source autopilot,"c++,  python,  embedded,  rtos,  ros",https://summerofcode.withgoogle.com/archive/2017/organizations/5801067908431872/
11,Babel,"Babel, the community driven compiler for writing next generation JavaScript","javascript,  babel,  nodejs",https://summerofcode.withgoogle.com/archive/2017/organizations/5933754749026304/
12,Bazel,Fast and correct build system for Google scale,"java,  linux,  go",https://summerofcode.withgoogle.com/archive/2017/organizations/5765787168014336/
13,BeagleBoard.org Foundation,"open hardware physical computing for makers, educators and professionals","javascript,  linux,  beaglebone,  python,  c",https://summerofcode.withgoogle.com/archive/2017/organizations/5370804795604992/
14,Beam Community,"From distributed systems, to robust servers and language design on the Erlang VM","erlang,  elixir,  lisp,  xmpp",https://summerofcode.withgoogle.com/archive/2017/organizations/5344914732744704/
15,BeeWare Project,The IDEs of Python. Tools for cross-platform Python application development.,"python,  mobile,  ios,  android",https://summerofcode.withgoogle.com/archive/2017/organizations/5213454373748736/
16,Berkman Klein Center for Internet and Society at Harvard University,"exploring cyberspace, sharing in its study & pioneering its development","ruby on rails,  meteor.js,  d3,  elasticsearch,  javascript",https://summerofcode.withgoogle.com/archive/2017/organizations/5825274612547584/
17,Blender Foundation,Free and open source 3D creation for artists and teams,"opengl,  opencl,  python,  c,  c++",https://summerofcode.withgoogle.com/archive/2017/organizations/6461479528169472/
18,Boost C++ Libraries,Boost provides free peer-reviewed portable C++ source libraries.,"c++,  c++11,  c++14,  boost",https://summerofcode.withgoogle.com/archive/2017/organizations/5196100961042432/
19,Boston University / XIA,Crowdsourcing the future Internet,"xia,  linux kernel,  c,  advanced data structures",https://summerofcode.withgoogle.com/archive/2017/organizations/4874213160648704/
20,BRL-CAD,"& LibreCAD, OpenSCAD, STEPcode, LinuxCNC, FreeCAD, & Slic3r!  Computer Graphics.","c/c++,  opencl,  python,  javascript,  qt",https://summerofcode.withgoogle.com/archive/2017/organizations/5302987798872064/
21,Cadasta,"Transforming the way land & resource rights are documented, managed and stored.","python,  django,  javasc,  javascipt",https://summerofcode.withgoogle.com/archive/2017/organizations/6571413242642432/
22,Catrobat,Computational thinking for all through visual mobile programming frameworks,"android,  java,  html5,  ios,  web",https://summerofcode.withgoogle.com/archive/2017/organizations/5758529210155008/
23,cBioPortal for Cancer Genomics,Developing open source solutions for precision medicine for cancer patients,"javascript,  java,  web,  reactjs,  web services",https://summerofcode.withgoogle.com/archive/2017/organizations/4741825894023168/
24,CCExtractor Development,Tools for a subtitled world.,"c,  python,  raspberry pi,  linux,  visual studio",https://summerofcode.withgoogle.com/archive/2017/organizations/5267426006532096/
25,Ceph,The Future of Storage,"c++,  python,  object-storage",https://summerofcode.withgoogle.com/archive/2017/organizations/6399849700261888/
26,CERN-HSF,"CERN-HEPSoftwareFoundation, umbrella organization for particle physics in GSoC","python,  c/c++,  machine learning,  data analysis,  parallel algorithms",https://summerofcode.withgoogle.com/archive/2017/organizations/6360460286754816/
27,Chapel,a Productive Parallel Programming Language,"chapel,  python,  high performance computing,  c,  c++",https://summerofcode.withgoogle.com/archive/2017/organizations/4757669491507200/
28,Checker Framework,"Preventing programming errors before they happen, via easy-to-use verification",java,https://summerofcode.withgoogle.com/archive/2017/organizations/6349316859887616/
29,Checkstyle,Dev tool to help programmers write Java code that adheres to a coding standard.,"java,  antlr",https://summerofcode.withgoogle.com/archive/2017/organizations/5883569398349824/
30,Classical Language Toolkit,NLP for the ancient world,"python,  javascript",https://summerofcode.withgoogle.com/archive/2017/organizations/4904328934457344/
31,"CLiPS, University of Antwerp",Computational (Psycho)Linguistics,"python,  machine learning,  mongodb,  javascript",https://summerofcode.withgoogle.com/archive/2017/organizations/4936781707345920/
32,Clojure,Supporting the Clojure and ClojureScript ecosystem,"clojure,  clojurescript,  jvm,  javascript,  functional programming",https://summerofcode.withgoogle.com/archive/2017/organizations/5054104644616192/
33,Cloud Native Computing Foundation (CNCF),The CNCF is a nonprofit committed to the development of cloud native technology,"kubernetes,  go,  prometheus,  fluentd,  grpc",https://summerofcode.withgoogle.com/archive/2017/organizations/6018829461225472/
34,CloudCV,Building platforms for reproducible AI research,"python,  django,  angularjs,  reactjs,  deep learning",https://summerofcode.withgoogle.com/archive/2017/organizations/6419112360148992/
35,CMU Sphinx,"Fast, Accurate, Flexible Open Source Speech Recognition","c,  cross-platform,  hidden markov models,  javascript,  python",https://summerofcode.withgoogle.com/archive/2017/organizations/5510422639673344/
36,coala,Linting and Fixing Code for All Languages,python,https://summerofcode.withgoogle.com/archive/2017/organizations/5817061024464896/
37,Computational Biology @ University of Nebraska-Lincoln,Development of software technologies for biomedical research and applications.,"javascript,  react,  java,  webgl,  mysql",https://summerofcode.withgoogle.com/archive/2017/organizations/6732113738989568/
38,Conversations.im,"Federated, end-to-end encrypted instant messaging based on XMPP/OMEMO","xmpp,  java,  android,  javafx,  python",https://summerofcode.withgoogle.com/archive/2017/organizations/5967780016816128/
39,Copyleft Games,"Game libraries, frameworks, and development toolkits","python,  opengl,  javascript,  c,  xmpp",https://summerofcode.withgoogle.com/archive/2017/organizations/6180004551458816/
40,DBpedia,"a Large, Multilingual, Semantic Knowledge Graph","java,  scala,  graph,  nosql,  rdf",https://summerofcode.withgoogle.com/archive/2017/organizations/5195579256733696/
41,Discourse,Civilized discussion for your community.,"ruby on rails,  ember,  ruby,  javascipt,  html/css",https://summerofcode.withgoogle.com/archive/2017/organizations/4878856288731136/
42,Django Software Foundation,The web framework for perfectionists with deadlines.,"python,  django",https://summerofcode.withgoogle.com/archive/2017/organizations/4608650232463360/
43,Drupal,"Drupal is a Free, Open, Modular CMS written in PHP. Let's make something amazing","php,  symfony,  sql,  javascript,  drupal 8",https://summerofcode.withgoogle.com/archive/2017/organizations/6388224565968896/
44,Eclipse Vert.x,Eclipse Vert.x is a tool-kit for building reactive applications on the JVM,"java,  reactive extensions,  kotlin,  microservices,  event-loop",https://summerofcode.withgoogle.com/archive/2017/organizations/5851994006749184/
45,Elm Software Foundation,A delightful functional language for reliable webapps.,"elm,  javascript,  haskell",https://summerofcode.withgoogle.com/archive/2017/organizations/5658990390280192/
46,Environmental Data And Governance Initiative,International network addressing threats to US environmental & energy policy,"python,  javascript,  ruby on rails,  google cloud,  go",https://summerofcode.withgoogle.com/archive/2017/organizations/4941941976334336/
47,Fedora Project,"Fedora Linux is built on the foundations of Freedom, Friends, Features, & First","python,  linux,  git,  postgres,  ansible",https://summerofcode.withgoogle.com/archive/2017/organizations/5870752142196736/
48,FFmpeg,"Cross-platform software to convert audio, video and subtitles.","c,  assembly,  git",https://summerofcode.withgoogle.com/archive/2017/organizations/4641979178680320/
49,FOSDEM,The organization that handles all aspects of the FOSDEM conference,"git,  ruby on rails,  postgresql,  html/css",https://summerofcode.withgoogle.com/archive/2017/organizations/5733807646834688/
50,FOSSASIA,Improve People's Lives,"python,  java,  javascript,  android,  php",https://summerofcode.withgoogle.com/archive/2017/organizations/5936828200779776/
51,Free and Open Source Silicon Foundation,Umbrella for various projects around open source hardware and tools,"verilog,  c,  vhdl,  python",https://summerofcode.withgoogle.com/archive/2017/organizations/5021512822161408/
52,FreeBSD,FreeBSD: The Foundation of the Internet,"c/c++,  llvm,  shell,  make,  assembly",https://summerofcode.withgoogle.com/archive/2017/organizations/5058101916991488/
53,Freifunk,Freifunk is a non-commercial initiative for free and open wireless networks.,"lede/openwrt,  c,  html/css,  shell script,  javascript",https://summerofcode.withgoogle.com/archive/2017/organizations/6004756195573760/
54,Frescobaldi,Edit music scores with GNU LilyPond.,"python,  pyqt",https://summerofcode.withgoogle.com/archive/2017/organizations/4597892144693248/
55,"Genes, Genomes and Variation",Genome databases and browsers,"mysql,  perl,  javascript",https://summerofcode.withgoogle.com/archive/2017/organizations/5455879507804160/
56,GENIVI Development Platform,Open Source Automotive Development Platform,"linux,  c,  yocto,  c++,  qt",https://summerofcode.withgoogle.com/archive/2017/organizations/4914104280023040/
57,Gentoo Foundation,"A flexible, source-based Linux distribution.","shell,  c/c++,  python,  linux",https://summerofcode.withgoogle.com/archive/2017/organizations/6287928489672704/
58,Git,"fast, scalable, distributed revision control system","c,  shell script,  git",https://summerofcode.withgoogle.com/archive/2017/organizations/5061577619275776/
59,Global Alliance for Genomics and Health,We develop open standards and tools for genomics to benefit human health.,"python,  java,  sql,  c++,  mongodb",https://summerofcode.withgoogle.com/archive/2017/organizations/6101170829393920/
60,GNOME,Non-profit organization that creates a computing platform for the general public,"c,  python,  gtk+,  javascript,  gobject",https://summerofcode.withgoogle.com/archive/2017/organizations/6040004186865664/
61,GNSS-SDR,An open source Global Navigation Satellite Systems software-defined receiver,"c/c++,  c++,  c++11,  c++14,  gnss",https://summerofcode.withgoogle.com/archive/2017/organizations/5204929132101632/
62,GNU Octave,Free Your Numbers,"c++,  hg",https://summerofcode.withgoogle.com/archive/2017/organizations/6187477526118400/
63,GNU Radio,The Free & Open Software Radio Ecosystem,"software defined radio,  c++,  python,  dsp",https://summerofcode.withgoogle.com/archive/2017/organizations/5467278887878656/
64,Green Navigation,Energy efficient routing for electric vehicles,"javascript,  java,  react,  apache spark,  tensorflow",https://summerofcode.withgoogle.com/archive/2017/organizations/6147412729004032/
65,Haiku,Light open-source operating system that specifically targets personal computing.,"c++,  posix",https://summerofcode.withgoogle.com/archive/2017/organizations/5096040436858880/
66,Homebrew,Homebrew is a package manager for macOS written in Ruby.,"ruby,  git,  github,  bash,  macos",https://summerofcode.withgoogle.com/archive/2017/organizations/6752289616297984/
67,illumos.org,Open Source successor of OpenSolaris,"dtrace,  illumos,  unix,  openzfs,  zfs",https://summerofcode.withgoogle.com/archive/2017/organizations/6221940343701504/
68,INCF,Advancing global collaborative brain research,"c++,  python,  java,  xml,  gpu",https://summerofcode.withgoogle.com/archive/2017/organizations/6593178794721280/
69,Inkscape,"Inkscape is a professional vector graphics editor for Windows, Mac OSX, & Linux.","svg,  css,  c++,  c++11,  python",https://summerofcode.withgoogle.com/archive/2017/organizations/5404830063394816/
70,Institute for Artificial Intelligence,Research in Artificial Intelligence and Perception for Autonomous Mobile Robots,"lisp,  prolog,  c++,  python,  ros",https://summerofcode.withgoogle.com/archive/2017/organizations/6330829038944256/
71,Intel Media and Audio for Linux,"Open Source Media libraries, Applications and User space driver.","video,  decode,  encode,  vpp,  multimedia",https://summerofcode.withgoogle.com/archive/2017/organizations/6149200777576448/
72,Internet Archive,Universal Access to All Knowledge,"python,  javascript",https://summerofcode.withgoogle.com/archive/2017/organizations/5373878247358464/
73,JBoss Community,Community of Java projects around JBoss Middleware,"java,  android,  asciidoctor,  mobil,  kubernetes",https://summerofcode.withgoogle.com/archive/2017/organizations/5307802188775424/
74,JdeRobot - Universidad Rey Juan Carlos,A software framework for developing applications in robotics and computer vision,"python,  c/c++,  ros,  gazebo",https://summerofcode.withgoogle.com/archive/2017/organizations/4923454155390976/
75,Jitsi,Advanced Real-Time Communication,"webrtc,  java,  javascript,  sip,  xmpp",https://summerofcode.withgoogle.com/archive/2017/organizations/5461033468559360/
76,Joomla,A free and Open Source CMS Trusted By Millions for their Websites,"php,  html,  html/css,  javascript,  jquery",https://summerofcode.withgoogle.com/archive/2017/organizations/5861923971137536/
77,JSK Robotics Laboratory,Humanoid Robotics Laboratory at the University of Tokyo,"ros,  lisp,  prolog,  openhrp,  openrtm",https://summerofcode.withgoogle.com/archive/2017/organizations/6380010977886208/
78,K-9 Mail,K-9 Mail – Advanced Email for Android,"android,  java",https://summerofcode.withgoogle.com/archive/2017/organizations/6184001823834112/
79,KDE,Experience Freedom!,"c++,  qt,  qt5",https://summerofcode.withgoogle.com/archive/2017/organizations/5586250824155136/
80,LabLua,Programming Languages Research with emphasis on  the Lua language,"lua,  céu",https://summerofcode.withgoogle.com/archive/2017/organizations/5842237585883136/
81,LibreHealth,Healthcare for Humanity,"java,  php,  javascript,  mysql",https://summerofcode.withgoogle.com/archive/2017/organizations/5574687430017024/
82,LibreOffice,"Free Office Suite, Fun Project, Fantastic People","c++,  python,  java",https://summerofcode.withgoogle.com/archive/2017/organizations/5507893709242368/
83,libvirt,virtualization abstraction library,"kvm,  xen,  hypervisor",https://summerofcode.withgoogle.com/archive/2017/organizations/6082542885142528/
84,Liquid Galaxy Project,Get immersed in open-source!,"javascript,  ros,  gis,  cesiumjs",https://summerofcode.withgoogle.com/archive/2017/organizations/5279287632461824/
85,LLVM Compiler Infrastructure,llvm,"llvm,  clang",https://summerofcode.withgoogle.com/archive/2017/organizations/6215410651234304/
86,lowRISC,Creating a fully open-source SoC design,"verilog,  chisel,  risc-v,  linux",https://summerofcode.withgoogle.com/archive/2017/organizations/5688479367299072/
87,LuaRocks,The package manager for the Lua programming language,"lua,  lua,  luarocks",https://summerofcode.withgoogle.com/archive/2017/organizations/5624527572697088/
88,MariaDB,One of the most popular databases on the web with many notable users,"mariadb,  mysql,  c,  c++,  java",https://summerofcode.withgoogle.com/archive/2017/organizations/4752192066027520/
89,Matrix.org,An ambitious open source project creating a new decentralised comms ecosystem.,"react,  android,  ios,  golang,  nodejs",https://summerofcode.withgoogle.com/archive/2017/organizations/6700587336859648/
90,MBDyn,High fidelity multibody dynamics engine with extended capabilities,"c++,  python",https://summerofcode.withgoogle.com/archive/2017/organizations/6633793616084992/
91,MetaBrainz Foundation Inc.,MetaBrainz operates MusicBrainz and a number of related open data projects.,"postgres,  perl,  python,  javascript,  bigquery",https://summerofcode.withgoogle.com/archive/2017/organizations/5723792051535872/
92,Metasploit,Open Source framework for exploit development and penetration testing,"ruby,  c,  asm",https://summerofcode.withgoogle.com/archive/2017/organizations/5632986779222016/
93,Microkernel devroom,"Confederation of microkernel projects (Genode, HelenOS, GNU Hurd, MINIX, Redox)","c,  c++,  rust,  arm,  x86",https://summerofcode.withgoogle.com/archive/2017/organizations/5026327212064768/
94,Mifos Initiative,End Poverty One Line of Code at a Time,"java,  android,  angularjs,  spring,  mysql",https://summerofcode.withgoogle.com/archive/2017/organizations/5486404108812288/
95,MIT App Inventor,Empowering anyone to make their world a better place,"java,  javascipt,  app,  google app engine,  gwt",https://summerofcode.withgoogle.com/archive/2017/organizations/6712150730997760/
96,Mixxx DJ Software,DJ Your Way. For Free.,"qt,  c++,  c++11,  midi,  hid",https://summerofcode.withgoogle.com/archive/2017/organizations/5298974017716224/
97,mlpack,a scalable C++ machine learning library,c++,https://summerofcode.withgoogle.com/archive/2017/organizations/5584462775582720/
98,Mobile Robot Programming Toolkit (MRPT),Mobile Robot Programming Toolkit: empowering C++ development in robotics,"qt,  c++,  opengl,  wxwidgets,  ros",https://summerofcode.withgoogle.com/archive/2017/organizations/5289044053327872/
99,Mono Project,Cross-platform C#/F#/.NET runtime and tools,"c#,  .net,  f#,  c",https://summerofcode.withgoogle.com/archive/2017/organizations/4814565460148224/
100,Moodle,The world's open source learning platform,"php,  jquery,  mysql,  postgresql,  javascript",https://summerofcode.withgoogle.com/archive/2017/organizations/5171600185884672/
101,MovingBlocks,Terasology: like an open source Minecraft - imagine the possibilities!,"java,  opengl,  blender,  json,  gradle",https://summerofcode.withgoogle.com/archive/2017/organizations/4985951029821440/
102,Mozilla,"Internet for people, not profit.","js,  rust,  html/css,  c++,  python",https://summerofcode.withgoogle.com/archive/2017/organizations/6414943960170496/
103,MuseScore,Free and open-source music notation software,"c++11,  qt5,  qt,  breakpad",https://summerofcode.withgoogle.com/archive/2017/organizations/4738118800375808/
104,National Resource for Network Biology (NRNB),Developing open source software to enable network-based biomedical discovery,"java,  javascript,  python,  php,  c++",https://summerofcode.withgoogle.com/archive/2017/organizations/6499778154201088/
105,Netfilter project,FOSS community-driven project that provides firewalling tools for Linux,"linux,  kernel,  c",https://summerofcode.withgoogle.com/archive/2017/organizations/6602954140286976/
106,Nmap Security Scanner,Swiss Army knife of network discovery and security auditing,"c/c++,  lua,  python,  c,  c++",https://summerofcode.withgoogle.com/archive/2017/organizations/5603880054292480/
107,NumFOCUS,NumFOCUS promotes open source scientific software.,"python,  javascript,  r,  c/c++",https://summerofcode.withgoogle.com/archive/2017/organizations/6630791836598272/
108,Open Bioinformatics Foundation,Promoting practice & philosophy of OSS & Open Science in biological research.,"python,  perl,  java,  c++,  c/c++",https://summerofcode.withgoogle.com/archive/2017/organizations/6098536001175552/
109,Open Chemistry,Advancing Open Source and Open Science for Chemistry,"python,  c++,  opengl,  javascript,  java",https://summerofcode.withgoogle.com/archive/2017/organizations/5928781713768448/
110,Open Data Kit,Open Data Kit is used to collect data for social good in difficult environments.,"android,  java,  python,  javascript,  ruby",https://summerofcode.withgoogle.com/archive/2017/organizations/4593100034932736/
111,Open Detection,Open Detection is a open source project for object detection and recognition.,"c++,  caffe,  pcl,  opencv",https://summerofcode.withgoogle.com/archive/2017/organizations/6015282623545344/
112,Open Genome Informatics,Open Genome Informatics represents the efforts of many bioinformatics projects.,"python,  java,  javascript,  nodejs,  gwt",https://summerofcode.withgoogle.com/archive/2017/organizations/4997812655751168/
113,Open States,Opening State Legislatures,"python,  django,  javascript,  postgresql",https://summerofcode.withgoogle.com/archive/2017/organizations/5076494711783424/
114,Open Technologies Alliance - GFOSS,Promote Openness through use and development of Open Standards and Technologies,"php,  java,  mysql,  virtuoso,  python",https://summerofcode.withgoogle.com/archive/2017/organizations/6266968780832768/
115,OpenAstronomy,Opening the eyes of research astronomy software to the whole world.,"python,  julia,  qt",https://summerofcode.withgoogle.com/archive/2017/organizations/6563063020912640/
116,OpenCV,Open Source Computer Vision and Machine Learning Library,"vision,  deep learning,  c++,  python",https://summerofcode.withgoogle.com/archive/2017/organizations/6424873924558848/
117,OpenMRS,Write Code. Save Lives.,"java,  javascript,  html/css,  hibernate,  mysql",https://summerofcode.withgoogle.com/archive/2017/organizations/6111850936664064/
118,OpenStreetMap,OpenStreetMap - Creating and distributing free geographic data for the world.,"postgis,  java,  ruby,  javascript",https://summerofcode.withgoogle.com/archive/2017/organizations/6746951777255424/
119,openSUSE,"The makers' choice for sysadmins, developers and desktop users.","ruby on rails,  javascript,  docker,  linux,  angular.js",https://summerofcode.withgoogle.com/archive/2017/organizations/6729779961135104/
120,OpenWISP,Open Source solution to build and manage wifi networks,"python,  django,  javascript,  openwrt,  raspberry pi",https://summerofcode.withgoogle.com/archive/2017/organizations/4763591446102016/
121,Oppia Foundation,Oppia is a tool for collaboratively building interactive and intelligent tutors.,"python,  google app engine,  angularjs,  javascript,  css",https://summerofcode.withgoogle.com/archive/2017/organizations/6040525891174400/
122,OSGeo,Open Source Geospatial Foundation,"c++,  python,  c,  sql,  java",https://summerofcode.withgoogle.com/archive/2017/organizations/4554340639440896/
123,oVirt,Open virtual datacenter management for all,"java,  python,  kvm",https://summerofcode.withgoogle.com/archive/2017/organizations/5718999941775360/
124,ownCloud,A safe home for all your data,"php,  qt,  android,  ios,  javascript",https://summerofcode.withgoogle.com/archive/2017/organizations/5721528872206336/
125,P2PSP.org,Shaping the future Internet TV,"c++,  python,  qt,  sockets,  webrtc",https://summerofcode.withgoogle.com/archive/2017/organizations/6195936732643328/
126,PEcAn Project,Develop accessible tools for reproducible ecosystem modeling and forecasting,"r,  php,  postgresql,  javascript,  c",https://summerofcode.withgoogle.com/archive/2017/organizations/4773366791667712/
127,Performance Co-Pilot,System-level performance analysis toolkit,"python,  javascript,  c,  linux,  windows",https://summerofcode.withgoogle.com/archive/2017/organizations/5840169290694656/
128,Pharo Consortium,Pharo: The Immersive Programming Experience,"smalltalk,  roassal,  polymath,  pharo",https://summerofcode.withgoogle.com/archive/2017/organizations/5691803940421632/
129,phpBB Forum Software,phpBB is the most widely used free and open source forum software,"php,  mysql,  javascript,  symfony,  css",https://summerofcode.withgoogle.com/archive/2017/organizations/5715998162288640/
130,phpMyAdmin,A web interface for MySQL written in PHP,"php,  mysql,  jquery,  javascript,  cakephp",https://summerofcode.withgoogle.com/archive/2017/organizations/5535586047754240/
131,Physical Web Project,Physical Web GSoC project based on the Physical Web,"beacon,  web bluetooth,  physical web,  bluetooth",https://summerofcode.withgoogle.com/archive/2017/organizations/6491731667189760/
